{
  "protocol_id": "example_device_protocol",
  "protocol_version": "0.1.0",
  "protocol_name": "example_device_protocol",
  "frames": [
    {
      "name": "telemetry_frame",
      "header": ["0xAA", "0x55"],
      "length": {
        "mode": "dynamic",
        "field": { "offset": 2, "length": 1, "type": "uint8" },
        "overhead_bytes": 5
      },
      "fields": [
        { "name": "sof0", "offset": 0, "length": 1, "type": "uint8", "description": "Start of frame byte 0 (0xAA)" },
        { "name": "sof1", "offset": 1, "length": 1, "type": "uint8", "description": "Start of frame byte 1 (0x55)" },
        { "name": "len", "offset": 2, "length": 1, "type": "uint8", "description": "Payload length (bytes)" },
        { "name": "msg_id", "offset": 3, "length": 1, "type": "uint8", "description": "Message ID" },
        { "name": "payload", "offset": 4, "length": { "ref": "len" }, "type": "bytes", "description": "Variable payload; length = len" }
      ],
      "checksum": {
        "type": "sum8",
        "range": { "from": 0, "to": -2 },
        "store_at": -1,
        "store_format": "uint8"
      }
    }
  ]
}
